Component,Type,German,English,French,Italian,Spanish,Dutch,Danish,Swedish,Norwegian,Slovenian,Croatian,Hungarian,Polish,Russian
EdtPassword,,PasswordChar,OnKeyPress,,,,,,,,,,,,
EdtPasswordKeyPress,TButton,DL-Passwort,DL password,Mot de passe DL,Password DL,Contraseรฑa DL,DL-paswoord,DL password,DL-password,DL lozinka,DL-kรณdszรณ,hasยณo DL,รร รฐรฎรซรผ รฃรฐร รดรจรชรจ,btnOk,&OK
LblPassword,TButton,Podaj hasยณo,รรขรฅรฑรฒรจ รฏร รฐรฎรซรผ,stHints,TfrmAccessLevel,btnCancel,btnDongleSearch,btnGraficAccess,btnGraficPW,btnOk,stDisplayLabels,stFonts,TfrmAccessLevel,Microsoft Sans Serif,stMultiLines
strcInvalidPassword,,Ungรผltiges Passwort!,Invalid password,Mot de passe non valable !,Password non corretta!,Contraseรฑa incorrecta,Ongeldig paswoord!,Ugyldigt password,Ogiltigt password,Neispravna lozinka,รrvรฉnytelen kรณdszรณ!,Haslo nieaktualne!,รรฅรครฅรฉรฑรฒรขรจรฒรฅรซรผรญรปรฉ รฏร รฐรฎรซรผ!,,
strcPWOkDatenauswahlFreigeschaltet,,Passwort OK! Erweiterte Datenauswahl beim DataLogger freigeschaltet.,Password OK! Additional data selection for DataLogger ready.,Mot de passe OK ! Accรจs au choix de donnรฉes รฉtendu autorisรฉ.,Password OK! La selezione dati ampliata nel Data Logger รจ resa accessibile.,ยกContraseรฑa correcta! Selecciรณn ampliada de datos en DataLogger.,Paswoord OK! Bijkomende datakeuze bij DataLogger vrijgegeven.,Password er OK! Udvidet dataudvalg ved datalogger mulig.,Password OK! Extra datatillgang,Lozinka OK! Daljnji izbor podataka u DataLoggeru slobodno uklapajuรฆi.,Kรณdszรณ OK! Bรตvรญtett adatvรกlasztรฉk a DataLogger-nรฉl engedรฉlyezve.,Haslo OK! Dodatkowy wybรณr danych dla DataLogger aktywny.,รร รฐรฎรซรผ OK! รรฒรชรฐรปรฒ รครฎรฑรฒรณรฏ รช รฐร รฑรธรจรฐรฅรญรญรฎรฌรณ รขรปรกรฎรฐรณ รคร รญรญรปรต รข รฐรฅรฃรจรฑรฒรฐร รฒรฎรฐรฅ รคร รญรญรปรต,,
strcSchluesselAnfordern,,Bitte Schlรผssel anfordern.,Please ask for key.,Demander la clรฉ.,Prego richiedere la chiave.,Pedir llave.,Gelieve sleutel op te vragen,Bestil nรธgle,Begรคr nyckel,Molim pribavite kljuรจ,Kรฉrje meg a kรณdszรณt.,Wymagany klucz.,รรฐรฅรกรณรฉรฒรฅ รชรซรพรท.,,
strcSchluesselEingegeben,,Inserire la chiave e azionare nuovamente il pulsante.,Poner llave y pulsar botรณn.,Sleutelwoord ingeven en schakelniveau opnieuw activeren!,Indsรฆt nรธgle og kvitter igen,Ange nyckel och bekrรคfta igen,Unesite kljuรจ i ponovno pritisnite tipku!,Kรณdszรณt megadni รฉs ismรฉt mรปkรถdtetni a kapcsolรกsi felรผletet!,Wpisz klucz i nacisnij ponownie przycisk!,รรฑรฒร รขรจรฒรผ รชรซรพรท รจ รฏรฎรขรฒรฎรฐรญรฎ รญร รฆร รฒรผ รชรญรฎรฏรชรณ!,TfrmAccessLevel.HelpFile,stCollections,stCharSets,TfrmAccessLevel,RUSSIAN_CHARSET
